{
  "schema": "factory/epic@1",
  "id": "E-0001",
  "rev": 8,
  "created_at": "2026-10-11T14:00:00.000Z",
  "updated_at": "2026-10-12T13:30:00.000Z",
  "goal_id": "G-001",
  "title": "Decoder service and API",
  "slug": "decoder-service",
  "summary": "Vendor client, cache table and the /vin/decode endpoint.",
  "depends_on": [],
  "status": "pr_open",
  "branch": "factory/E-0001-decoder-service",
  "base_branch": "main",
  "pr": {
    "number": 128,
    "url": "https://github.com/example/dealer-app/pull/128",
    "state": "OPEN",
    "head_sha": "a1b2c3d4e5f6",
    "review_decision": null,
    "mergeable": "MERGEABLE",
    "merged_at": null
  },
  "gates": {
    "G4": "GATE-0006"
  },
  "tasks": [
    "T-0007",
    "T-0008",
    "T-0009",
    "T-0010",
    "T-0011"
  ]
}
